,title_ru,title_en,year,rating_kp,director,actors,country,genre,plot,duration,poster_url,Age_limit
0,Интерстеллар,Interstellar,2014,8.3,Кристофер Нолан,"Мэттью Макконахи, Энн Хэтэуэй","США, Великобритания","фантастика, драма, приключения","Земля умирает от засухи и пыльных бурь. Бывший астронавт Купер отправляется через кротовину нору в другую галактику, чтобы найти для человечества новый дом. Его миссия сталкивается с парадоксами времени: пока он ищет спасение в космосе, на Земле проходят годы, и его дети взрослеют без отца.",169 мин,https://avatars.mds.yandex.net/get-kinopoisk-image/1600647/430042eb-ee69-4818-aed0-a312400a26bf/72x108,12+
1,Побег из Шоушенка,The Shawshank Redemption,1994,8.3,Фрэнк Дарабонт,"Тим Роббинс, Морган Фриман",США,"драма, криминал","Банкир Энди Дюфрейн осуждён за убийство жены и отправлен в Шоушенк — одну из самых суровых тюрем. Там он знакомится с контрабандистом Рэдом и обретает надежду. Годы заключения не ломают Энди: он помогает заключённым и охранникам, храня тайну, которая позволит ему обрести свободу.",142 мин,https://avatars.mds.yandex.net/get-kinopoisk-image/1599028/0b76b2a2-d1c7-4f04-a284-80ff7bb709a4/72x108,0+
2,Джентльмены,The Gentlemen,2019,8.2,Гай Ричи,"Мэттью Макконахи, Чарли Ханнэм","Великобритания, США","криминал, комедия, боевик","Американский эмигрант Микки Пирсон построил прибыльную марихуановую империю в Лондоне и собирается выйти из бизнеса. Слух об этом привлекает внимание конкурентов, пытающихся захватить его дело. Частный детектив Флетчер расследует историю, в которой все пытаются перехитрить друг друга.",113 мин,https://avatars.mds.yandex.net/get-kinopoisk-image/1599028/637271d5-61b4-4e46-ac83-6d07494c7645/72x108,18+
3,Зеленая миля,The Green Mile,1999,8.1,Фрэнк Дарабонт,"Том Хэнкс, Дэвид Морс",США,"драма, фэнтези, криминал","Тюрьма 1930-х годов. Надзиратель Пол Эджкомб руководит блоком смертников. Однажды туда поступает огромный чернокожий Джон Коффли, осуждённый за убийство двух девочек. Коффли обладает невероятным даром исцеления, и Пол начинает сомневаться в его виновности, понимая, что казнит невинного человека.",189 мин,https://avatars.mds.yandex.net/get-kinopoisk-image/1599028/4057c4b8-8208-4a04-b169-26b0661453e3/72x108,6+
4,Властелин колец: Возвращение короля,The Lord of the Rings: The Return of the King,2003,8.1,Питер Джексон,"Элайджа Вуд, Вигго Мортенсен","Новая Зеландия, США","фэнтези, приключения, драма","Финальная часть эпопеи. Армия Саурона подходит к Минас Тириту, и люди Средиземья объединяются для последней битвы. Фродо и Сэм под проводником Голлума приближаются к Роковой горе, чтобы уничтожить Кольцо Всевластия, но Голлум замышляет предательство.",201 мин,https://avatars.mds.yandex.net/get-kinopoisk-image/4303601/e410c71f-baa1-4fe5-bb29-aedb4662f49b/72x108,12+
5,Остров проклятых,Shutter Island,2010,8.1,Мартин Скорсезе,"Леонардо ДиКаприо, Марк Руффало",США,"триллер, детектив, драма","1954 год. Федеральный маршал Тедди Дэниелс прибывает на остров Шаттер, где находится психиатрическая лечебница для опасных преступников, чтобы расследовать исчезновение пациентки. Чем глубже он погружается в тайны больницы, тем больше сомневается в реальности происходящего и собственной вменяемости.",138 мин,https://avatars.mds.yandex.net/get-kinopoisk-image/4303601/617303b7-cfa7-4273-bd1d-63974bf68927/72x108,16+
6,1+1,Intouchables,2011,8.1,Оливье Накаш,"Франсуа Клюзе, Омар Си",Франция,"драма, комедия, биография","Богатый аристократ Филипп, прикованный к инвалидному креслу, нанимает себе в помощники Дрисса — молодого энергичного парня из предместий, только что вышедшего из тюрьмы. Между двумя людьми, казалось бы, не имеющими ничего общего, завязывается неожиданная дружба, которая меняет жизнь обоих.",112 мин,https://avatars.mds.yandex.net/get-kinopoisk-image/10900341/caf9f155-1a19-42f1-a0f3-9c8773e9083e/72x108,6+
7,Бойцовский клуб,Fight Club,1999,8.1,Дэвид Финчер,"Эдвард Нортон, Брэд Питт","США, Германия","триллер, драма","Офисный работник, страдающий бессонницей, встречает харизматичного продавца мыла Тайлера Дердена. Они создают Бойцовский клуб, где мужчины бьют друг друга для очищения от рутины. Клуб перерастает в радикальное движение, а главный герой discovers шокирующую правду о себе и Тайлере.",139 мин,https://avatars.mds.yandex.net/get-kinopoisk-image/16490236/495fb59a-bff1-4626-baba-bb392fede945/72x108,6+
8,Властелин колец: Братство кольца,The Lord of the Rings: The Fellowship of the Ring,2001,8.1,Питер Джексон,"Элайджа Вуд, Иэн Маккеллен","Новая Зеландия, США","фэнтези, приключения, драма","Молодой хоббит Фродо наследует Кольцо Всевластия, дарующее неограниченную власть его владельцу. Чтобы спасти мир от тёмного властелина Саурона, Фродо вместе с Братством Кольца отправляется в опасное путешествие к Роковой горе, где единственное место, где Кольцо можно уничтожить.",178 мин,https://avatars.mds.yandex.net/get-kinopoisk-image/6201401/a2d5bcae-a1a9-442f-8195-f5373a5ba77f/72x108,16+
9,Форрест Гамп,Forrest Gump,1994,8.0,Роберт Земекис,"Том Хэнкс, Робин Райт",США,"драма, мелодрама, комедия","Человек с низким IQ, но с золотым сердцем, Forrest Гамп бессознательно становится участником важнейших событий американской истории второй половины XX века. Он создаёт успешный бизнес, служит во Вьетнаме и встречает президентов, но его единственная мечта — быть рядом с любимой Дженни.",142 мин,https://avatars.mds.yandex.net/get-kinopoisk-image/1599028/3560b757-9b95-45ec-af8c-623972370f9d/72x108,16+
10,Терминатор 2: Судный день,Terminator 2: Judgment Day,1991,8.0,Джеймс Кэмерон,"Арнольд Шварценеггер, Линда Хэмилтон","США, Франция","фантастика, боевик","2029 год. Машины отправляют в прошлое Т-1000 — жидкометаллического терминатора, чтобы убить будущего лидера сопротивления Джона Коннора. Но повстанцы отправляют перепрограммированного Т-800 для его защиты. Два киборга сходятся в смертельной битве за судьбу человечества.",137 мин,https://avatars.mds.yandex.net/get-kinopoisk-image/10893610/2dd14742-f241-42ca-9db4-331e3a483c50/72x108,16+
11,Властелин колец: Две крепости,The Lord of the Rings: The Two Towers,2002,8.0,Питер Джексон,"Элайджа Вуд, Иэн Маккеллен","Новая Зеландия, США","фэнтези, приключения, драма","Братство Кольца расколото. Фродо и Сэм продолжают путь к Роковой горе под властью Кольца, Арагорн, Леголас и Гимли объединяются с роханцами для битвы при Хельмовой Пади, а возрождённый Гэндальф готовится к решающему противостоянию с силами Саурона и Сарумана.",179 мин,https://avatars.mds.yandex.net/get-kinopoisk-image/6201401/772093e4-7f68-49aa-a805-d654693aee26/72x108,16+
12,Унесённые ветром,Gone with the Wind,1939,8.0,Виктор Флеминг,"Вивьен Ли, Кларк Гейбл",США,"драма, мелодрама, исторический","Юг Америки, Гражданская война. Упрямая и очаровательная Скарлетт О'Хара переживает войну, разрушение семьи и потерю всего, что ей дорого. Её жизнь переплетается с жизнями двух мужчин — благородного Эшли и циничного Ретта Батлера, но Скарлетт слишком поздно понимает, кого любит по-настоящему.",238 мин,https://avatars.mds.yandex.net/get-kinopoisk-image/4774061/0e8db812-35c1-4650-8c76-654f6eed9535/72x108,18+
13,Начало,Inception,2010,8.0,Кристофер Нолан,"Леонардо ДиКаприо, Джозеф Гордон-Левитт","США, Великобритания","фантастика, боевик, триллер","Дом Кобб — мастер извлечения секретов из подсознания людей во время сна. Ему предлагают imposible задачу: не украсть идею, а внедрить её. Если он справится, то получит шанс вернуться к своим детям. Кобб собирает команду для самой сложной операции — внедрения идеи на трёх уровнях сновидений.",148 мин,https://avatars.mds.yandex.net/get-kinopoisk-image/1629390/8ab9a119-dd74-44f0-baec-0629797483d7/72x108,16+
14,Унесённые призраками,Sen to Chihiro no kamikakushi,2001,7.9,Хаяо Миядзаки,"Руми Хиираги, Мию Ирино",Япония,"аниме, фэнтези, приключения","Десятилетняя Тихиро переезжает с родителями в новый дом и случайно попадает в волшебный мир духов и богов. Родители превращаются в свиней, и Тихиро вынуждена работать в купальнях ведьмы Юбабы, чтобы найти способ вернуть их в человеческий облик и выбраться из этого мира.",,https://avatars.mds.yandex.net/get-kinopoisk-image/6201401/ae3b699c-3db7-4196-a869-39b610bfe706/72x108,6+
15,Криминальное чтиво,Pulp Fiction,1994,7.9,Квентин Тарантино,"Джон Траволта, Сэмюэл Л. Джексон",США,"криминал, драма, комедия","Несколько переплетающихся историй из жизни лос-анджелесского криминального мира: два киллера обсуждают философию, боксёр бежит с деньгами мафии, пара грабителей пытается ограбить ресторан, а жена босса отправляется на свидание с его подручным. Все истории связаны случайными совпадениями.",154 мин,https://avatars.mds.yandex.net/get-kinopoisk-image/4716873/0a07a903-9025-4aff-bf7c-46bbb175888c/72x108,16+
16,Темный рыцарь,The Dark Knight,2008,7.9,Кристофер Нолан,"Кристиан Бэйл, Хит Леджер","США, Великобритания","боевик, криминал, драма","Бэтмен и прокурор Харви Дент объединяют усилия против криминала Готэма, но появляется Джокер — хаотичный преступник без мотивов, жаждущий доказать, что любой человек может пасть. Джокер ставит горожан перед невозможным выбором, а Дент становится жертвой трагедии, превращающей его в Двуликого.",152 мин,https://avatars.mds.yandex.net/get-kinopoisk-image/1599028/0fa5bf50-d5ad-446f-a599-b26d070c8b99/72x108,6+
17,Зеленая книга,Green Book,2018,7.9,Питер Фаррелли,"Вигго Мортенсен, Махершала Али",США,"драма, комедия, биография","1962 год. Итало-американский вышибала Тони Лип нанимается водителем к утончённому чернокожему пианисту Дону Ширли для тура по южным штатам. Пользуясь «Зелёной книгой» — справочником заведений для чернокожих, — они преодолевают расовые барьеры и становятся друзьями вопреки предрассудкам.",130 мин,https://avatars.mds.yandex.net/get-kinopoisk-image/4483445/1e2ed281-b1e8-4083-b721-3ece7afc1031/72x108,12+
18,Операция «Ы» и другие приключения Шурика,Pride & Prejudice,1965,7.9,Леонид Гайдай,"Александр Демьяненко, Наталья Селезнёва",Франция,"драма, комедия, биография","Богатый аристократ Филипп, прикованный к инвалидному креслу, нанимает себе в помощники Дрисса — молодого энергичного парня из предместий, только что вышедшего из тюрьмы. Между двумя людьми, казалось бы, не имеющими ничего общего, завязывается неожиданная дружба, которая меняет жизнь обоих.",112 мин,https://avatars.mds.yandex.net/get-kinopoisk-image/4774061/ccd69a69-7405-4b41-89a8-60dd6dc2a3ee/72x108,6+
19,Волк с Уолл-стрит,The Wolf of Wall Street,2013,7.9,Мартин Скорсезе,"Леонардо ДиКаприо, Джона Хилл",США,"драма, криминал, комедия","История Джордана Белфорта — брокера, построившего финансовую империю на обмане и мошенничестве. От скромного начала до шикарной жизни с яхтами, самолётами и безудержными тратами. Белфорт наслаждается жизнью, пока ФБР не начинает расследование его махинаций.",180 мин,https://avatars.mds.yandex.net/get-kinopoisk-image/9784475/44bc954c-acdb-45d7-8ce1-6a9b25f4ca92/72x108,12+
20,Гладиатор,Gladiator,2000,7.8,Ридли Скотт,"Рассел Кроу, Хоакин Феникс","США, Великобритания","боевик, драма, исторический","Римский генерал Максимус одерживает победу над германцами и заслуживает благосклонность императора Марка Аврелия. Но сын императора Коммод убивает отца и захватывает власть, казнив семью Максимуса. Бывший генерал становится гладиатором и жаждет мести в Колизее перед всем Римом.",155 мин,https://avatars.mds.yandex.net/get-kinopoisk-image/1599028/7c3460dc-344d-433f-8220-f18d86c8397d/72x108,12+
21,Крестный отец,The Godfather,1972,7.8,Фрэнсис Форд Коппола,"Марлон Брандо, Аль Пачино",США,"драма, криминал","История семьи Корлеоне — одной из самых могущественных мафиозных семей Америки. Старый дон Вито Корлеоне управляет империей, но после покушения на его жизнь его младший сын Майкл, ранее не участвовавший в делах семьи, вынужден взять власть в свои руки и становится ещё более безжалостным, чем отец.",175 мин,https://avatars.mds.yandex.net/get-kinopoisk-image/10703959/ebf237d7-64a3-4b75-98f1-d228d54658e5/72x108,6+
22,Список Шиндлера,Schindler's List,1993,7.8,Стивен Спилберг,"Лиам Нисон, Бен Кингсли",США,"драма, исторический, биография","Вторая мировая война. Немецкий бизнесмен Оскар Шиндлер прибывает в Краков, чтобы заработать на войне. Постепенно он осознаёт масштабы Холокоста и решает спасти как можно больше евреев, выкупая их для работы на своей фабрике. Его список становится разницей между жизнью и смертью для более тысячи человек.",195 мин,https://avatars.mds.yandex.net/get-kinopoisk-image/6201401/1e1ac6d9-c658-4f5f-937e-d080bca0d893/72x108,0+
23,Назад в будущее,Back to the Future,1985,7.8,Роберт Земекис,"Майкл Дж. Фокс, Кристофер Ллойд",США,"фантастика, комедия, приключения","Подросток Марти Макфлай случайно отправляется на 30 лет в прошлое на машине времени, созданной учёным Доком Брауном. В 1955 году он мешает знакомству своих родителей и должен устроить их встречу, иначе он никогда не родится. Параллельно он ищет способ вернуться в 1985 год.",116 мин,https://avatars.mds.yandex.net/get-kinopoisk-image/1599028/73cf2ed0-fd52-47a2-9e26-74104360786a/72x108,0+
24,Тайна Коко,Coco,2017,7.8,Ли Анкрич,"Энтони Гонсалес, Гаэль Гарсиа Берналь",США,"анимация, фэнтези, приключения","Двенадцатилетний Мигель мечтает стать музыкантом, но в его семье музыка под запретом. В День мёртвых он случайно попадает в Страну Мёртвых, где встречает души предков. Мигель должен раскрыть тайну семейного запрета и найти путь домой до рассвета, иначе он останется в мире духов навсегда.",105 мин,https://avatars.mds.yandex.net/get-kinopoisk-image/1946459/6e11a16e-c9e7-491f-9162-01098a7d8dd9/72x108,12+
25,Шрэк,Shrek,2001,7.8,Эндрю Адамсон,"Майк Майерс, Эдди Мерфи",США,"анимация, комедия, приключения","Огр Шрек живёт в уединении на болоте, но его покой нарушается, когда сказочные существа, выселенные лордом Фаркуадом, селятся у него. Чтобы вернуть болото, Шрек отправляется спасать принцессу Фиону из башни дракона в компании болтливого осла, не подозревая, что это путешествие изменит его жизнь.",90 мин,https://avatars.mds.yandex.net/get-kinopoisk-image/1946459/7ade06a8-4178-4386-9ee2-87fec5a172eb/72x108,18+
26,Леон,Léon,1994,7.7,Люк Бессон,"Жан Рено, Натали Портман","Франция, США","триллер, драма, криминал","Профессиональный киллер Леон живёт одинокой жизнью в Нью-Йорке. Когда коррумпированный полицейский убивает семью его юной соседки Матильды, Леон берёт девочку под свою защиту. Между ними возникает необычная связь: Леон учит Матильду своему ремеслу, а она пробуждает в нём человеческие чувства.",110 мин,https://avatars.mds.yandex.net/get-kinopoisk-image/6201401/8662d92a-5881-4600-a7ae-549e6fd53b03/72x108,6+
27,Пятый элемент,The Fifth Element,1997,7.7,Люк Бессон,"Брюс Уиллис, Милла Йовович",Франция,"фантастика, боевик, комедия","XXIII век. К Земле приближается Великая Тьма — космическое зло, угрожающее уничтожить всё живое. Спасение — в пятом элементе, идеальном существе Лилу, которую находят учёные. Таксист-бывший майор Корбен Даллас случайно оказывается вовлечён в миссию по спасению человечества.",126 мин,https://avatars.mds.yandex.net/get-kinopoisk-image/4483445/36d8bd84-fc0f-428e-8a51-111c2aef34be/72x108,16+
28,"Поймай меня, если сможешь",Catch Me If You Can,2002,7.7,Стивен Спилберг,"Леонардо ДиКаприо, Том Хэнкс",США,"драма, комедия, криминал, биография","Основано на реальной истории Фрэнка Абигнейла-младшего, который до 19 лет успел поработать пилотом, врачом и юристом, подделывая документы и чеки на миллионы долларов. За ним охотится агент ФБР Карл Хэнрэтти, но Фрэнк всегда на шаг впереди, пока однажды не решает остановиться.",141 мин,https://avatars.mds.yandex.net/get-kinopoisk-image/1704946/e38dd6f9-610e-4c90-8540-dc48560cb9cc/72x108,6+
29,Большой куш,Snatch,2000,7.7,Гай Ричи,"Джейсон Стэйтем, Стивен Грэм","Великобритания, США","криминал, комедия","Лондонский криминальный мир охвачен погоней за украденным бриллиантом. Несколько банд, цыганский боксёр и жестокий гангстер пересекаются в хаотичном водовороте событий. Каждый пытается перехитрить другого, но удача предпочитает самых неожиданных героев.",104 мин,https://avatars.mds.yandex.net/get-kinopoisk-image/4303601/47fe48f6-ff17-4411-a12f-d337bea2639d/72x108,6+
