,title_ru,title_en,year,rating_kp,director,actors,country,genre,plot,duration,poster_url,Age_limit
30,Проект «Конец света»,Project Hail Mary,2026,7.7,Фил Лорд,"Райан Гослинг, Сандра Хюллер",США,"фантастика, драма, приключения","Одинокий астронавт просыпается на космическом корабле, не помня кто он и как тут оказался. Постепенно он вспоминает, что является последней надеждой человечества: он должен решить загадку угасающего солнца. На своём пути он встречает неожиданного союзника — инопланетное существо со схожей миссией.",140 мин,https://avatars.mds.yandex.net/get-kinopoisk-image/10703959/ce97c5a2-eb29-4f42-b229-ca69cb05b2ae/72x108,16+
31,Достучаться до небес,Knockin' on Heaven's Door,1997,7.7,Томас Ян,"Тиль Швайгер, Ян Йозеф Лиферс",Германия,"криминал, комедия, драма","Двое неизлечимо больных пациентов хосписа — буйный Мартин и тихий Руди — узнают, что им осталось жить несколько дней. Они решают провести последние дни на море и угоняют машину босса мафии, за ними начинается погоня. Это история о дружбе и о том, как по-настоящему жить, когда времени мало.",87 мин,https://avatars.mds.yandex.net/get-kinopoisk-image/4483445/df6c9527-c2cb-4a17-b4bd-1ed05d2e733d/72x108,0+
32,Аватар,Avatar,2009,7.7,Джеймс Кэмерон,"Сэм Уортингтон, Зои Салдана","США, Великобритания","фантастика, боевик, приключения","Парализованный морпех Джейк Салли отправляется на Пандору — планету с ценным минералом. В теле аватара — местного жителя на'ви — он должен разведать территорию. Но познакомившись с на'ви и полюбив Нейтири, Джейк оказывается перед выбором: выполнить приказ или защитить мир, ставший ему родным.",162 мин,https://avatars.mds.yandex.net/get-kinopoisk-image/1599028/4adf61aa-3cb7-4381-9245-523971e5b4c8/72x108,18+
33,Матрица,The Matrix,1999,7.7,Лана Вачовски,"Киану Ривз, Лоренс Фишбёрн",США,"фантастика, боевик","Программист Томас Андерсон живёт двойной жизнью: днём — обычный работник, ночью — хакер Нео. Он узнаёт, что реальность — это симуляция, созданная машинами, поработившими человечество. Нео присоединяется к повстанцам и начинает путь к тому, чтобы стать Избранным и освободить людей.",136 мин,https://avatars.mds.yandex.net/get-kinopoisk-image/4774061/cf1970bc-3f08-4e0e-a095-2fb57c3aa7c6/72x108,6+
34,Престиж,The Prestige,2006,7.7,Кристофер Нолан,"Хью Джекман, Кристиан Бэйл","США, Великобритания","триллер, драма, детектив","Два талантливых иллюзиониста — Роберт Энджер и Альфред Борден — становятся заклятыми соперниками. Их профессиональная конкуренция перерастает в одержимость, и каждый готов на всё, чтобы превзойти другого. Их вражда приводит к созданию невероятного фокуса, цена которого оказывается непомерно высока.",130 мин,https://avatars.mds.yandex.net/get-kinopoisk-image/1773646/0e1384ae-6367-4bba-9e5d-d91c6625371e/72x108,16+
35,Бесславные ублюдки,Inglourious Basterds,2009,7.6,Квентин Тарантино,"Брэд Питт, Кристоф Вальц","США, Германия","военный, драма, комедия","Вторая мировая война. Отряд американских солдат-евреев под командованием лейтенанта Альдо Рейна терроризирует нацистов во Франции, жестоко расправляясь с ними. Параллельно молодая француженка Шосанна, чья семья погибла от рук нацистов, готовит месть во время премьеры фильма в кинотеатре.",153 мин,https://avatars.mds.yandex.net/get-kinopoisk-image/1946459/5e6dde98-74a8-4c02-b003-01d48e091025/72x108,16+
36,Титаник,Titanic,1997,7.6,Джеймс Кэмерон,"Леонардо ДиКаприо, Кейт Уинслет",США,"драма, мелодрама","1912 год. Бедный художник Джек выигрывает билет на «Титаник» в покер и знакомится на борту с Роуз — девушкой из высшего общества, насильно выданной замуж за надменного Кала. Между Джеком и Роуз вспыхивает любовь, но их история обрывается катастрофой — корабль сталкивается с айсбергом.",194 мин,https://avatars.mds.yandex.net/get-kinopoisk-image/10592371/7f0e6761-4635-46ad-b804-59d5cf1ae85c/72x108,18+
37,Отступники,The Departed,2006,7.6,Мартин Скорсезе,"Леонардо ДиКаприо, Мэтт Дэймон",США,"триллер, криминал, драма","Бостонский мафиозный босс Фрэнк Костелло внедряет своего человека в полицию, а полиция посылает своего агента под прикрытием в банду Костелло. Обе стороны пытаются вычислить чужого осведомителя, пока напряжённая игра в кошки-мышки не приводит к смертельной развязке.",151 мин,https://avatars.mds.yandex.net/get-kinopoisk-image/1898899/f2c70176-43c8-4ca6-8f67-7119a2b73f19/72x108,18+
38,Пираты Карибского моря: Проклятие Черной жемчужины,Pirates of the Caribbean: The Curse of the Black Pearl,2003,7.6,Гор Вербински,"Джонни Депп, Джеффри Раш",США,"фэнтези, приключения, комедия","Эксцентричный капитан Джек Воробей объединяется с кузнецом Уиллом Тёрнером, чтобы спасти дочь губернатора Элизабет из рук капитана Барбоссы и его команды проклятых пиратов. Пираты, обращённые в нежить, ищут последний кусок золота ацтеков, чтобы снять проклятие.",143 мин,https://avatars.mds.yandex.net/get-kinopoisk-image/1773646/d7e3dbd6-e4a9-4485-b751-d02f49825166/72x108,12+
39,"Карты, деньги, два ствола","Lock, Stock and Two Smoking Barrels",1998,7.6,Гай Ричи,"Джейсон Флеминг, Декстер Флетчер",Великобритания,"криминал, комедия","Четверо друзей-мелких мошенников собирают деньги на карточную игру, но главный герой проигрывает криминальному боссу 500 тысяч фунтов и должен вернуть долг за неделю. Друзья решают ограбить соседей-наркоторговцев, но в дело вмешиваются всё новые участники, и планы путаются.",,https://avatars.mds.yandex.net/get-kinopoisk-image/1599028/6492653f-11d5-4087-a1d2-ec7a74f161d3/72x108,18+
40,Я ругаюсь,I Swear,2023,7.6,Кирк Джонс,"Роберт Арамайо, Питер Муллан",Германия,комедия,"Комедия о подростке, который обнаруживает, что его невероятная способность ругаться может приносить пользу. Необычный дар меняет его жизнь и отношения с окружающими, показывая, что даже из самых неожиданных талантов можно извлечь пользу.",,https://avatars.mds.yandex.net/get-kinopoisk-image/10768063/473bbd97-86cb-44f6-b923-cd3bc8761c57/72x108,12+
